0.698353	0.27534	0.808472	0.434961	anger	sadness	Przygnębiony ciężarem sumienia, zawstydzony wzrok wlepił w ziemię.
0.698353	0.27534	0.808473	0.434961	anger	surprise	— Ale, ale!...
0.698353	0.27534	0.808473	0.434961	anger	sadness	Od wieków tak bardzo odosobieni, samotni, nie żyjąc z nikim, rodziną się tylko własną i sami sobą otaczając starczyli sobie, ani z sąsiadami, ani z tymi do których wypadki ich zbliżały nie zawiązując ściślejszych stosunków.
0.698353	0.27534	0.808473	0.434961	anger	surprise	Nie wspomniał nic o warunkach, pod jakimi ochotnicy zgodzili się na tę naukę.
0.698353	0.27534	0.808473	0.434961	anger	anticipation	Zapatrzyła się w rękę.
0.698353	0.27534	0.808472	0.434961	anger	anticipation	Słucham was, panie von Bergow.
0.698353	0.27534	0.808473	0.434961	anger	anticipation	— Nie zaraz odbędzie się tyle przeze mnie upragniona uroczystość.
0.698353	0.27534	0.808473	0.434961	anger	anger	— Ach, gdyby wiedzieli — mówił z gniewem władca — jak faraon jest bezsilny i ubogi, każdy nomarcha zechciałby być panem swego nomesu!...
0.698353	0.27534	0.808473	0.434961	anger	sadness	Śmiech jej krył wzruszenie, które mi sprawiło ból.
0.698353	0.27534	0.808473	0.434961	anger	trust	— Będę się wpatrywał w plamy atramentowe... będę wiernie pilnował klejnotów!
0.698353	0.27534	0.808473	0.434961	anger	fear	— Kto pan jesteś? czego tu chcesz?...
0.698353	0.27534	0.808472	0.434961	anger	fear	— Bój się Boga, Senderl!
0.698353	0.27534	0.808473	0.434961	anger	anticipation	— Ależ chcę wiedzieć...
0.698353	0.27534	0.808473	0.434961	anger	anticipation	Padre Torquemada stał przy oknie zamyślony, na koniec odwrócił się i podszedł do stołu.
0.698353	0.27534	0.808473	0.434961	anger	trust	Zrozumiałaś mnie.
0.698353	0.27534	0.808473	0.434961	anger	anticipation	— Marku, a Drakecity?
0.698353	0.27534	0.808473	0.434961	anger	neutral	Byłto młody chłopak z jasnemi włosy, skromnie, ale czysto odziany, wyglądający na leśniczego lub pisarza, z torbą myśliwską na plecach, w czarnych, długich po kolana butach, z harapnikiem przez plecy, w wiejskim kapeluszu słomianym na głowie.
0.698353	0.27534	0.808472	0.434961	anger	surprise	Mówcie, którzy stąd jesteście: prawda-li to?
0.698353	0.27534	0.808472	0.434961	anger	anticipation	Co?
0.698353	0.27534	0.808473	0.434961	anger	anticipation	To pewnie i gazety pisze?
0.698353	0.27534	0.808473	0.434961	anger	sadness	Innym znów razem, w dzień chłodny płukać musiała wraz z praczkami bieliznę nad brzegiem jeziora.
0.698353	0.27534	0.808473	0.434961	anger	anger	Tyś go zabił — podchwycił sędzia.
0.698353	0.27534	0.808473	0.434961	anger	anticipation	— zapytała.
0.698351	0.275344	0.808473	0.434961	anger	anger	— mruknął stary ze złością i, nie skończywszy obiadu, wyszedł, a Janka była w takiem usposobieniu, że aby mu zrobić więcej przykrości, kazała koniom czekać przed dworem całe dwie godziny, i z pewną przyjemnością widziała, że stary kilka razy wyglądał z oficyny na podjazd, klął głośno na marnowanie czasu i na jaśnie państwo, i, nie mogąc wkońcu wytrzymać, krzyknął na stangreta:
0.698353	0.27534	0.808473	0.434961	anger	disgust	Wolałby jednak pozostać w domu i czytać tę książkę, niżeli iść na wieczór do baronowej, gdzie nie znajdzie najpewniej nic nowego, ani szczególnie przyjemnego.
0.698353	0.27534	0.808472	0.434961	anger	sadness	Nadeszła chwila, że tłumione łkanie wstrząsnęło te rycerskie piersi.
0.698353	0.27534	0.808473	0.434961	anger	fear	Oto szczepienie będzie spóźnione, oto profesor będzie umierał w najstraszliwszych, w najdzikszych męczarniach.
0.698353	0.27534	0.808473	0.434961	anger	joy	Nie znam w istocie szczęśliwszego małżeństwa.
0.698353	0.27534	0.808473	0.434961	anger	joy	Oswald w jego wieku znał się nawet na zegarze słonecznym.
0.698353	0.27534	0.808473	0.434961	anger	sadness	Mąż zabity, syn uległ wypadkowi, córka pod ziemią, może już martwa, a w dodatku chory starzec, dziecko okaleczałe skutkiem wypadku i wreszcie córka zmarła z głodu podczas strajku.
0.698353	0.27534	0.808473	0.434961	anger	anticipation	Dowiedź tego!
0.698353	0.27534	0.808473	0.434961	anger	sadness	Wyrwał ze złoconych ram portret matki i zwinął go; w złotych ramach pozostała czarna pustka.
0.698353	0.27534	0.808472	0.434961	anger	anticipation	Kanclerz państwa i inni dopraszali się, aby Władysław niezwłócząc udał się do Szegedynu, gdzie posłowie tureccy przybyć mieli.
0.698353	0.27534	0.808472	0.434961	anger	anger	— Słuchaj — rzekł zniecierpliwiony tem do Fotofera, przybyłego w odwiedziny jednego poranku, jak to może być żebym ja się dał temu Włochowi pokonać i odszedł z niczem.
0.698353	0.27534	0.808472	0.434961	anger	surprise	Pierwszy raz to we wsi czy co!
0.698353	0.27534	0.808473	0.434961	anger	disgust	Ciało: to szatan, to złość, to niedoskonałość, zgnilizna i robactwo; duch jedyną prawdą.
0.698353	0.27534	0.808473	0.434961	anger	surprise	— Przysięgam, że tego po tobie się nie spodziewałem.
0.698353	0.27534	0.808473	0.434961	anger	sadness	Tak nad niemi pochyloną z boku schwyciła pantera, drasnęła ją ledwie, i piękna jej główka jak zwiędły kwiat pochyliła się blada, prawie bez śmiertelnego wysiłku...
0.698353	0.27534	0.808473	0.434961	anger	anger	Nie!
0.698353	0.27534	0.808473	0.434961	anger	surprise	— Aa?!...
0.698353	0.27534	0.808473	0.434961	anger	neutral	Historja wahającego się oblubieńca i zerwanego małżeństwa może temu odpowiadać, jak recenzja rozsądnego dziennikarza może dać treść sztuki Ibsena.
0.698353	0.27534	0.808472	0.434961	anger	anticipation	— Czy powiedział coś?
0.698353	0.27534	0.808473	0.434961	anger	anger	Z przyjemnością rzuciłabym mu wprost w twarz, że Halszka go nienawidzi.
0.698353	0.27534	0.808473	0.434961	anger	anger	— Idź do diabła!
0.698353	0.27534	0.808473	0.434961	anger	sadness	Znów siedział w milczeniu, strasznie tęsknym wzrokiem patrząc w dal, jakby szukając tej zmarnowanej okazji odznaczenia się; rozwarte nozdrza zdawały się chwytać upajającą woń tej zmarnowanej sposobności.
0.698353	0.27534	0.808472	0.434961	anger	neutral	— Już go raz słyszałem.
0.698353	0.27534	0.808473	0.434961	anger	neutral	Mnie zaraz powiedziała, jako było.
0.698353	0.27534	0.808473	0.434961	anger	neutral	Po nabożeństwie odbyło się zebranie rady kościelnej.
0.698353	0.27534	0.808473	0.434961	anger	joy	— ozwał się Kim, parskając śmiechem, a oczy mu się zaświeciły.
0.698353	0.27534	0.808473	0.434961	anger	fear	Na miły Bóg, bądź ostrożna!
0.698353	0.27534	0.808473	0.434961	anger	sadness	I sam ten człowiek, gdyby nawet był wolny, nie byłby zdolny do poważnego przywiązania, gdy ona — czuła to dobrze — potrafiłaby w życiu kochać tylko raz.
0.698353	0.27534	0.808473	0.434961	anger	neutral	— Nie wiem, panie dyrektorze.
0.698353	0.27534	0.808473	0.434961	anger	anticipation	— Gotów nieboszczyk?...
0.698353	0.27534	0.808473	0.434961	anger	anger	Puść mnie, wolnym chcę być!
0.698353	0.27534	0.808473	0.434961	anger	sadness	— Bóg widzi, że moja hardość została za bramą tutejszą.
0.698353	0.27534	0.808473	0.434961	anger	anticipation	Weźcie mnie z sobą.
0.698353	0.27534	0.808473	0.434961	anger	sadness	Lampka żółtym cieniem spowija izbę suteryny, jej ubogie sprzęty i znużone świętem twarze mieszkańców.
0.698353	0.27534	0.808472	0.434961	anger	fear	A kiedy wyszła z pierwszego osłupienia, gdy jeden rok i drugi minął głucho, czuła niepokój w głębi piersi, jakby trzepotanie źle związanych skrzydeł.
0.698353	0.27534	0.808473	0.434961	anger	anger	— Och, daj spokój!
0.698353	0.27534	0.808472	0.434961	anger	neutral	— panem dziedzicem Nawłoci z przyległościami.
0.698353	0.27534	0.808472	0.434961	anger	sadness	—... Odszedłeś od nas — wołały płaczki — nie ma cię, panie... osierociłeś nas biednych...
0.698353	0.27534	0.808473	0.434961	anger	joy	Anna ocknęła się, wzruszona serdecznością Franciszka.
0.698353	0.27534	0.808473	0.434961	anger	joy	Mason aż pozieleniał z radości.
0.698353	0.27534	0.808472	0.434961	anger	anticipation	— Domyślałam się — powiedziała — że na coś się zanosi, chociaż Sämund nic mi nie powiedział.
0.698353	0.27534	0.808473	0.434961	anger	trust	Gdybym miał ciebie tego dnia, licytowałbym wyżej i utrzymałbym się przy kupnie.
0.698353	0.27534	0.808473	0.434961	anger	surprise	— Nie wiedziałem, że się interesujesz zoologią.
0.698353	0.27534	0.808473	0.434961	anger	neutral	Pojadę do Szczytna.
0.698353	0.27534	0.808472	0.434961	anger	neutral	Bernard obojętnie podniósł ramiona.
0.698353	0.27534	0.808473	0.434961	anger	trust	— Co komu Pan Bóg przeznaczył, to go i tak nie minie — odparł Litwin.
0.698353	0.27534	0.808472	0.434961	anger	sadness	Teraz dopiero z setek i tysięcy szczegółów układałem w sobie obraz zmarłej, ów obraz, który mi wszędzie towarzyszy.
0.698353	0.27534	0.808472	0.434961	anger	fear	I przerażona czuje, że serce jej tłuc się zaczyna jak ptak w klatce.
0.698353	0.27534	0.808473	0.434961	anger	surprise	— Skąd tak idziesz?
0.698353	0.27534	0.808473	0.434961	anger	trust	Bogu polecam moje dzieci!
0.698353	0.27534	0.808473	0.434961	anger	sadness	Może życie niczego więcej nie warte!
0.698353	0.27534	0.808472	0.434961	anger	surprise	— A nie chceszli wyspowiadać się przed drogą?
0.698353	0.27534	0.808473	0.434961	anger	joy	I widząc, że ciotka naprawdę nie wie, co znaczy piszczyk, aby mieć przyjemność okazania, że jest w równym stopniu wykształcona jak purystka, i aby zadrwić z ciotki, zadrwiwszy poprzednio z pani de Cambremer, rzekła na wpół ze śmiechem, powściąganym przez resztki udanego złego humoru:
0.698353	0.27534	0.808473	0.434961	anger	disgust	Lekkie szyderstwo brzmiało w jego głosie.
0.698353	0.27534	0.808473	0.434961	anger	anger	Niechże się ów komtur przekona, że nie twoja zapalczywość, ale nasze prawa karzą śmiercią za porwanie się na osobę posła.
0.698353	0.27534	0.808473	0.434961	anger	surprise	Czy to miał być protest?
0.698353	0.27534	0.808473	0.434961	anger	anticipation	Staś przyszedł do pokoju zawiadowcy i czekał, bo Orłowski chodził wzdłuż pokoju, spoglądał w dwa okna peronu, to przez okienko kasowe, wychodzące na korytarz, wychylał głowę i nasłuchiwał.
0.698353	0.27534	0.808472	0.434961	anger	anger	— Utaił by się przed innemi, nie przedemną!
0.698353	0.27534	0.808473	0.434961	anger	sadness	Bito nas nie patrząc gdzie.
0.698353	0.27534	0.808473	0.434961	anger	joy	— Ach, dobrze, żem se spomniał!
0.698353	0.27534	0.808473	0.434961	anger	anger	— Po cóż ja ciebie urodziiiłam!...
0.698353	0.27534	0.808473	0.434961	anger	surprise	Nie?
0.698353	0.27534	0.808472	0.434961	anger	anticipation	— Więc zrobi pani, o co prosiłem?...
0.698353	0.27534	0.808472	0.434961	anger	surprise	— spytał Harvey, nie mogąc jeszcze sobie uprzytomnić, że jego życie było najzupełniej bezpieczne.
0.698353	0.27534	0.808473	0.434961	anger	surprise	— Ale jak ty zrozumiesz tę ich mowę?
0.698353	0.27534	0.808473	0.434961	anger	anticipation	— Cóż będziesz robił po obiedzie?
0.698353	0.27534	0.808472	0.434961	anger	disgust	Dał Maciuś dzieciom prawa i patrzcie, co zrobiły.
0.698353	0.27534	0.808473	0.434961	anger	fear	A wtem na krańcach, gdzie niebo zdawało się stykać z ziemią i rozciągały się mgły sinawe, w tych mgłach właśnie zamajaczało coś i poczęło się poruszać, wypełzały jakieś kształty, z początku mętne, które zwierając się stopniowo, stawały się coraz wyraźniejsze.
0.698353	0.27534	0.808473	0.434961	anger	neutral	— wołał Pantera.
0.698353	0.27534	0.808472	0.434961	anger	joy	Nareszcie otwarły się drzwiczki do numeru Płazy-Spławskiego, nareszcie światło...
0.698354	0.275342	0.808474	0.434962	anger	neutral	W Dobromilu, na etapie w kancelarii, zapisywano wszystkich jeńców jednego po drugim, co odbywało się nie bez trudu, ponieważ wśród wszystkich trzystu jeńców, spędzonych do Dobromila z różnych stron, nie było ani jednego, który rozumiałby mowę rosyjską sierżanta siedzącego za stołem i pełniącego obowiązki tłumacza we Wschodniej Galicji, bo twierdził o sobie, że język rosyjski zna.
0.698353	0.27534	0.808473	0.434961	anger	surprise	— Zwaryowałeś?
0.698353	0.27534	0.808473	0.434961	anger	anticipation	Dołożycie starań, aby wcisnąć się do rozmównicy jakiegoś klasztoru; ploteczki tych pustelnic nie będą dla nas bez pożytku.
0.698353	0.27534	0.808473	0.434961	anger	surprise	— Jak to?
0.698353	0.27534	0.808472	0.434961	anger	surprise	Rózia postrzegła tylko mundur i przelękła się, sądząc że w mieszkaniu Juljana robić będą rewizyą, ale w chwili gdy ta myśl po jéj główce przebiegła, poznała w zbliżającym się kniazia z bukietem w ręku i pudełkiem cukierków.
0.698353	0.27534	0.808473	0.434961	anger	neutral	Tak rozmawiając, zbliżyli się do Krakowa.
0.698353	0.27534	0.808473	0.434961	anger	surprise	Czy kto uwierzy, iż są takie domy?
0.698353	0.27534	0.808472	0.434961	anger	surprise	Jest pełna!
0.698353	0.27534	0.808472	0.434961	anger	anticipation	Rozkazał pracować i ochraniać od złego ile w mej mocy i oddać temu tylko, kto, oprócz urzędowej legitymacyi, przyniesie mi znak umówiony z przyjacielem.
0.698353	0.27534	0.808472	0.434961	anger	anticipation	Podróżny podjechał bliżej, a na orszak skinął, dając znak, żeby na niego zaczekał.
0.698353	0.27534	0.808472	0.434961	anger	disgust	Słowo Niemca to fałsz...
0.698353	0.27534	0.808473	0.434961	anger	surprise	— A to, synku, zapomniałeś, że ci przybył jeszcze jeden obowiązek?
0.698353	0.27534	0.808473	0.434961	anger	fear	Ale gdy tak mówiła, drwiące jej oczy lśniły tak żywo, że książę nie mógł ich znieść; spojrzał na sufit, co było u niego ostatecznym znakiem krańcowego zakłopotania.
0.698353	0.27534	0.808473	0.434961	anger	anticipation	Wielki, choć z całej siły tłumiony gwałt pożądania był w tych prośbach...
0.698353	0.27534	0.808473	0.434961	anger	surprise	Czyż pan nie wie, że przynajmniej raz na miesiąc Jagoda podaje się do dymisji.
0.698353	0.27534	0.808473	0.434961	anger	disgust	— Wcale nie samotnych.
0.698353	0.27534	0.808472	0.434961	anger	joy	— Mój ojcze!
0.698353	0.27534	0.808472	0.434961	anger	sadness	Wokulski czuł, że ten mrok, żal i smutek wypływał z jego serca i że to wszystko zakończy się chyba z życiem, jeżeli się zakończy...
0.698353	0.27534	0.808473	0.434961	anger	trust	Komu jest dobrze, temu się widzi, że wszystko się dzieje na świecie, jak przynależy, jak Pan Bóg przykazał!
0.698353	0.27534	0.808472	0.434961	anger	surprise	W pierwszej chwili sądziłem, że to intryga miłosna.
0.698353	0.27534	0.808472	0.434961	anger	anticipation	— spytałem go, kiedyśmy wyszli na ganek, — nie mając już siły powstrzymać tych słów, co od godziny prawie paliły mi wargi.
0.698353	0.27534	0.808472	0.434961	anger	anticipation	— Jutro, lub dziś nawet.
0.698353	0.27534	0.808473	0.434961	anger	fear	A jak okaże się, że komitet zbyt pośpiesznie wydał rozkaz egzekucji?
0.698353	0.27534	0.808473	0.434961	anger	disgust	— Potworny jest — rzekła.
0.698353	0.27534	0.808472	0.434961	anger	disgust	Doprawdy, nadto jest pewny siebie.
0.698353	0.27534	0.808473	0.434961	anger	sadness	Na mnie spada cała ich złość dlatego, że ja was bronię z narażeniem moich dóbr w Neapolitańskiem, siebie...
0.698353	0.27534	0.808473	0.434961	anger	anticipation	Postrzegłszy to, pan Michał pociągnął wszystkich ze sobą do bramy, aby się wjeżdżającym przypatrywać.
0.698353	0.27534	0.808472	0.434961	anger	trust	No, a cmentarz! widzicie, że mi nic nie zaszkodził, to i wam przy mnie nicby się nie stało...
0.698353	0.27534	0.808473	0.434961	anger	disgust	Jeszcze tak nie jest, ale on z dniem każdym jest tłuściejszy.
0.698353	0.27534	0.808473	0.434961	anger	anger	Chce podobać się Solskiemu, a bałamuci innych!
0.698353	0.27534	0.808472	0.434961	anger	joy	Jaka ta Laura szczęśliwa ze swoim wiecznym spokojem!
0.698353	0.27534	0.808473	0.434961	anger	anticipation	Przez ustalenie jego tożsamości można będzie wykryć, z kim oskarżony miał do czynienia, a także będzie można poznać jego współwinnych.
0.698353	0.27534	0.808472	0.434961	anger	sadness	Chybaż on się powiesi — ów Bohun — ale już jemu czarownica przepowiadała, że on tej, o której myśli, nigdy nie dostanie i że Lach ją posiędzie, a ten Lach to pewnie jegomość.
0.698353	0.27534	0.808472	0.434961	anger	joy	Za każdym razem, kiedy chodziłem się odlać za te lipy na końcu ogrodu, dusza moja czuła się odświeżona widokiem tych przyjaciół.
0.698353	0.27534	0.808473	0.434961	anger	neutral	Rejentka lekko skinęła głową i rzekła do Ajdara:
0.698353	0.27534	0.808473	0.434961	anger	neutral	A wtedy ojciec mój powtórzył:
0.698353	0.27534	0.808473	0.434961	anger	fear	Suknia, kapelusz, okrywka i parasolka, wszystko musi być nowe, a tu tak niewiele czasu i nie tylko nic nie zamówione, ale nawet nie wybrane!...
0.698353	0.27534	0.808472	0.434961	anger	anticipation	— Wiesz, dziecko, że ojciec sam chce mówić z panem...
0.698353	0.27534	0.808473	0.434961	anger	anticipation	— Staram się wejść w położenie tego przemysłowca.
0.698353	0.27534	0.808472	0.434961	anger	trust	Godzę się z losem.
0.698353	0.27534	0.808472	0.434961	anger	anticipation	Gdyby ów młody człowiek zjawił się za naszych szczęśliwych dni, gdyby przyniósł Brygidzie jakiś obojętny list, czyż byłbym nań zwrócił jaką bądź uwagę?
0.698353	0.27534	0.808472	0.434961	anger	joy	W tej chwili pani Flora przystąpiła do nich, śmiejąc się na całe swoje puszyste gardziołko.
0.698353	0.27534	0.808472	0.434961	anger	anticipation	Uklękła i pociągnęła go, aby uczynił to samo.
0.698353	0.27534	0.808473	0.434961	anger	neutral	Zawiadowca, skoro tylko mu tamten zniknął z oczu powrócił do kancelaryi i zajął się załatwianiem urzędowych korespondencyi.
0.698353	0.27534	0.808473	0.434961	anger	surprise	Aż się biali królowie sami przestraszyli, że za dużo zabiją.
0.698353	0.27534	0.808473	0.434961	anger	anticipation	Ależ on tu nie próżnuje, więc jeszcze idzie naprzód.
0.698353	0.27534	0.808472	0.434961	anger	joy	Zdumiony tym niezwykłym objawem uczucia, spojrzał na nią namiętnie; przy śniadaniu wydała mu się bardzo ładna; mimo że miał spuszczone oczy, cały czas rozbierał w myśli jej wdzięki.
0.698353	0.27534	0.808473	0.434961	anger	neutral	Podeszła do Morela.
0.698353	0.27534	0.808473	0.434961	anger	joy	— Ot, tu jest na to lekarstwo!
0.698353	0.27534	0.808473	0.434961	anger	sadness	Petrek głowę spuścił, nie mówił nic.
0.698353	0.27534	0.808472	0.434961	anger	anticipation	— Halo, dziewczynko!
0.698353	0.27534	0.808473	0.434961	anger	sadness	W izbach, przez które przechodzili, cisza panowała i smutny mrok wieczora je zalegał.
0.698353	0.27534	0.808473	0.434961	anger	anticipation	— Panu Braunowi kazałam, by zaraz mi wszystko donosił.
0.197657	0.0812737	0.215793	0.0989958	anger	fear	Strasznie chciało mu się jechać, ale zlazł jak niepyszny i ponieważ mrok już zapadał, poszedł za ogrody odmówić wieczorne pacierze, ale mógł się to zebrać w sobie, kiedy jakaś dzieuszyna piesneczka dzwoniła gdzieś niedaleko i baby rajcowały w jakimś sadzie, że każde słowo leciało po rosie, i wrzeszczały dzieci kąpiące się w stawie, kajś znów śmiechy się zatrzęsły, to ryki krów, to księże perliczki darły się przenikliwie i cała wieś huczała przeróżnymi pogłosami niby ten ul rozbrzęczany, że cięgiem mu się myliło, a gdy nareszcie uchwycił wątek i przyklęknąwszy pod żytem wtopił rozmodlone oczy w to niebo rozgwiażdżone i poniósł duszę kajś w zaświaty, buchnęły od wsi takie przeraźliwe krzyki, lamenta i przeklinania, że poleciał ku domowi wystraszony wielce i niespokojny.
0.698353	0.27534	0.808472	0.434961	anger	anger	— zawoła Don Kichot — tu nie czas na żarty, na wszystko jest właściwa pora; teraz nie pora na żarty.
0.698353	0.27534	0.808472	0.434961	anger	disgust	Bodajeś nigdy matką nie była!
0.698353	0.27534	0.808473	0.434961	anger	anger	Wziął na stronę przyjaciela, i rzekł mu: — Pani Ru ma złe serce!
0.698353	0.27534	0.808472	0.434961	anger	anticipation	— Niech pan zaatakuje pierwszy południk.
0.698353	0.27534	0.808472	0.434961	anger	fear	Nie mógł mnie przecie nikt zobaczyć w tych łachmanach.
0.698353	0.27534	0.808472	0.434961	anger	joy	Mówiła to śpiewnie, z dziwnym upojeniem w głosie, który zdawał się wzbierać i drżeć, jakby chciał więcej powiedzieć, niż te proste słowa wyrażały.
0.698353	0.27534	0.808473	0.434961	anger	joy	Cicho, sekretnie pochwalała tę rozpustę nocną, która nareszcie jej duszę uzdrowiła, wyzwoliła, oblała zimną rosą spokoju.
0.698353	0.27534	0.808473	0.434961	anger	anger	— A nie obłaskawię, bo i ten będzie jeszcze mój, niech się jeno ciepło zrobi, to już umyśliłem taki sposób na niego, że nie wytrzyma na plebanii, a przyleci!
0.698353	0.27534	0.808473	0.434961	anger	fear	Zasypywano pociskami zamek, zasypywano miasto, wszystkie bramy, wszystkie baszty.
0.698353	0.27534	0.808472	0.434961	anger	anticipation	— dodał, ja z Neorżą moim powoli sobie radę dam.. jam nie wieczny, ani on...
0.698353	0.27534	0.808472	0.434961	anger	fear	— Ja dawniej wiszę — szepnął cicho Andrzej, z jakimś ledwie odczutym akcentem bólu, i twarz mu pobladła, ale oczy natychmiast rozbłysły dawną energją wytrwania i uporu.
0.698353	0.27534	0.808473	0.434961	anger	sadness	Ból jego serdeczny coraz bardziej ginął pod uczuciem wstydu, upokorzenia, zranionej miłości własnej.
0.698353	0.27534	0.808473	0.434961	anger	sadness	Nie sposób było pisać ni jeść porządnie, słowem sto razy w ciągu dnia brakowało mi tych przedmiotów.
0.698353	0.27534	0.808473	0.434961	anger	disgust	— Wracajcie skądeście przyszli.
0.698353	0.27534	0.808472	0.434961	anger	sadness	Nie miał nikogo, z kim mógłby, lub chciał podzielić się myślami.
0.698353	0.27534	0.808472	0.434961	anger	sadness	Ale zapomniałam o biednych w Sacca!
0.698353	0.27534	0.808473	0.434961	anger	joy	O prześlicznie, panie O’Haro!
0.698353	0.27534	0.808473	0.434961	anger	surprise	— O!
0.698353	0.27534	0.808472	0.434961	anger	surprise	Nagle zadzwoniło, zawirowało.
0.698353	0.27534	0.808473	0.434961	anger	surprise	Nie powiadano ci jeszcze?
0.698353	0.27534	0.808473	0.434961	anger	fear	Grzmoty zgłuszyły strzelaninę i zataczając się kołem, dudniąc, hucząc, budziły straszne echo w skałach.
0.698353	0.27534	0.808473	0.434961	anger	neutral	Toteż wkrótce w wyznaczonym miejscu stanęła walcowata budka, jakby pieprzniczka, nakryta szpiczastym dachem.
0.698353	0.27534	0.808472	0.434961	anger	fear	— bełkotał przestraszony, bo Antek puścił kosę i szedł ku niemu blady, ze strasznymi oczami.
0.698353	0.27534	0.808472	0.434961	anger	trust	— W jego ręku teraz zbawienie ojczyzny, a że gotów za nią życie oddać, niech mu Bóg błogosławi.
0.698353	0.27534	0.808472	0.434961	anger	joy	Radość i zapał błysły w oczach Edmunda i złotnik się oddalił, pozostawiając swego młodego przyjaciela w najrozkoszniejszych oczekiwaniach.
0.698353	0.27534	0.808472	0.434961	anger	sadness	Przekazywali sobie osobliwe wieści o pogrzebie wielkiego chana.
0.698353	0.27534	0.808472	0.434961	anger	surprise	Ze zdumieniem spostrzegła, że służba zapala nad stołami lampy ze światłem skoncentrowanym.
0.698353	0.27534	0.808472	0.434961	anger	joy	— Jesteś dobry i wielki, mój panie — rzekła Hayde, całując dłoń hrabiego — jestem szczęśliwa, że należę do ciebie.
0.698353	0.27534	0.808473	0.434961	anger	sadness	— Istny potop — szepnął po chwili, a opierając czoło o szybę, dodał — Ciemno choć oko wykol.
0.698353	0.27534	0.808473	0.434961	anger	sadness	Dlatego gdy tamte szczęśliwe... ja umieram z upokorzenia, z tęsknoty, ze wstydu.
0.698353	0.27534	0.808473	0.434961	anger	joy	Winszuję panu, panie Murek.
0.698353	0.27534	0.808473	0.434961	anger	surprise	Nigdy jeszcze nie widziałam człowieka w takim stanie.
0.698353	0.27534	0.808472	0.434961	anger	neutral	Jedno na pierwszym piętrze za sto franków dziennie, drugie na trzecim za dziesięć franków.
0.698353	0.27534	0.808473	0.434961	anger	anger	— Od chwili gdy zostałeś panem Egiptu, zbrodniarzami są ci, którzy ośmielają się widywać ciebie i nie zdawać sprawy z tego, o czym raczysz mówić...
0.698353	0.27534	0.808473	0.434961	anger	neutral	Sadownik Zajmweł odwiózł do domu zmiętą czerwoną pościel i ostatni wózek zimowych jabłek.
0.698353	0.27534	0.808473	0.434961	anger	neutral	Otworzyłem „ Le Figaro ”.
0.698353	0.27534	0.808473	0.434961	anger	anticipation	Wyczekawszy jeszcze chwilę, puknął leciuchno w ten sam sposób.
0.698353	0.27534	0.808472	0.434961	anger	joy	Dziewczynka też, którą Jan naparł się wziąć od matki, mileńka była, wesoleńka i zawczasu już porządek w chacie robić zaczęła, a i bratowa, choć płocha i w romansach niepowściągniona, dzieci swoje często nawiedzała i jego doglądała, wesołą swoją gadatliwością babską śmiesząc czasem i rozrywając.
0.698353	0.27534	0.808473	0.434961	anger	neutral	— pytał karczmarza Zagłoba.
0.698353	0.27534	0.808473	0.434961	anger	anger	— Ośle głupi!
0.698353	0.27534	0.808473	0.434961	anger	anticipation	— Chciałbym, aby byli przy tym Albert de Morcerf i Raul de Château-Renaud; wiesz pan, że prosiłem ich już na świadków.
