1.0	0.0	0.0	0.0	joy	anticipation	— Czekać wystrzału.
1.0	0.0	0.0	0.0	joy	fear	Pełno krwi na was...
1.0	0.0	0.0	0.0	joy	anger	Miłosierny Bóg niechaj uczyni to, aby wrogowie nasi utonęli we własnej krwi z ran, które wy im zadacie! ”
1.0	0.0	0.0	0.0	joy	anger	Nie zawojujecie tych ziem!
1.0	0.0	0.0	0.0	joy	surprise	— Kto taki?
1.0	0.0	0.0	0.0	joy	anticipation	— A tyś co robił, jak go nie było?
1.0	0.0	0.0	0.0	joy	anger	Beetle, bierz go!
1.0	0.0	0.0	0.0	joy	surprise	— Czy nigdy się nie modliłaś w życiu?
1.0	0.0	0.0	0.0	joy	surprise	— Procą?
1.0	0.0	0.0	0.0	joy	surprise	— Ależ nie miałeś strzelby z sobą?
1.0	0.0	0.0	0.0	joy	disgust	— Nie przystoi to mojej czci szlacheckiej.
1.0	0.0	0.0	0.0	joy	joy	Pochwal się, że jesteś.
1.0	0.0	0.0	0.0	joy	anger	Nienawidzę tego okrutnego rygoru i żelaznej logiki tych ludzi, którzy pojedyncze osoby czynią odpowiedzialnymi za losy narodów! ”
1.0	0.0	0.0	0.0	joy	joy	— dokończył powstrzymując śmiech knecht.
1.0	0.0	0.0	0.0	joy	joy	A oni krzyczą: „ Niech żyje ulica, niech żyje Pupek! ”.
1.0	0.0	0.0	0.0	joy	joy	Za piękną Greczynką, która jechała znużona do kąpieli, gryząc w ustach zwiędły kwiatek, biegli konno na desultorskich rumakach, młodzi synowie rycerzy, upojeni wonią, winem i śpiewami, śpiesząc do Ganeów pompejańskich, na miłosne schadzki z ulubienicami...
1.0	0.0	0.0	0.0	joy	anger	Oto sprzykrzyły mi się twoje posądzenia, nie w smak i to, że na mnie ustawnie brwi marszczysz i surowie spoglądasz...
1.0	0.0	0.0	0.0	joy	neutral	— Opisuję ci pusty kraj w Północnej Ameryce, nazywany Parkiem Narodowym.
1.0	0.0	0.0	0.0	joy	joy	Monte Christo uśmiechnął się.
1.0	0.0	0.0	0.0	joy	surprise	Teraz ledwo–ledwo rozumiem, że się to ze mną zdarzyło.
1.0	0.0	0.0	0.0	joy	joy	Wszyscy uniesieni szczytnym krajobrazem byli niezdolni sformułować tych wrażeń, jakich doznawali.
1.0	0.0	0.0	0.0	joy	anger	Ty napchana jesteś trocinami — i może ci z tym dobrze.
1.0	0.0	0.0	0.0	joy	anger	— Nigdy!
1.0	0.0	0.0	0.0	joy	joy	W minutę później ciocia Gabriela była już zdrowa.
1.0	0.0	0.0	0.0	joy	neutral	Na wieżach Panny Marii biły dzwony, napełniając miasto spiżowym dźwiękiem i płosząc stada kawek i gołębi.
1.0	0.0	0.0	0.0	joy	anger	Tu nie o łowach myśleć trzeba!
1.0	0.0	0.0	0.0	joy	anger	— Nie zapomniałam cię, drapichruście!
1.0	0.0	0.0	0.0	joy	surprise	Z kolei Plersch, słuchając, niemal osłupiał.
1.0	0.0	0.0	0.0	joy	joy	Jaka mama będzie szczęśliwa, żeśmy się spotkali! ” Było mi równie pilno dowiedzieć się jej nazwiska, jak jej ujrzeć że się kłaniam wreszcie ze świadomością rzeczy i że jej uśmiech, wytrzymywany bez końca niby nuta gis, może się wreszcie skończyć.
1.0	0.0	0.0	0.0	joy	joy	Rozweseliły mnie nieco dawno znane, rzęsiście oświetlone magazyny i sklepy i z lżejszym już sercem wysiadałem przy Gray’s Inn.
1.0	0.0	0.0	0.0	joy	anticipation	— Jeszcze, jeszcze trochę!
1.0	0.0	0.0	0.0	joy	anger	Głupi człowiecze! głupi!
1.0	0.0	0.0	0.0	joy	anticipation	Masz pan dla mnie może trochę złota za moje talary?
1.0	0.0	0.0	0.0	joy	anger	Czy tego nie widzisz?
1.0	0.0	0.0	0.0	joy	surprise	Wówczas pojął, że go oszukano.
1.0	0.0	0.0	0.0	joy	anger	— Powiadam paniczkom, Sodoma, Gomora, a jakże!
1.0	0.0	0.0	0.0	joy	disgust	Twarz jego i broda były bladożółte, a ręce i odzienie zawalane bezecnym plugastwem.
1.0	0.0	0.0	0.0	joy	disgust	Prawdziwe paskudztwo.
1.0	0.0	0.0	0.0	joy	anger	— No bo co?.. zbijesz mnie, wyrzucisz na śmieci, nie dasz jeść?..
1.0	0.0	0.0	0.0	joy	surprise	— Cóż takiego? co? na Boga! podnosząc się z siedzenia odezwała się wylękła Dobkowa.
1.0	0.0	0.0	0.0	joy	surprise	To dziwne, przecież minął już tydzień.
1.0	0.0	0.0	0.0	joy	joy	Z dumą spoglądać nań mogła młoda pani.
1.0	0.0	0.0	0.0	joy	surprise	— Co?
1.0	0.0	0.0	0.0	joy	joy	Delikatny wietrzyk hasał po pokoju.
1.0	0.0	0.0	0.0	joy	surprise	Mój Boże.
1.0	0.0	0.0	0.0	joy	trust	Serce jego szerokie.
1.0	0.0	0.0	0.0	joy	neutral	Wtedy też do izby wsunęła się Franka i, jak widmo cicha, przesunąwszy się pod ścianą, w kącie na ziemi usiadła.
1.0	0.0	0.0	0.0	joy	trust	Ten dobry ojciec Morlon miał wielki wpływ na moją inteligencję; miał Szekspira w przekładzie pana Letourneur; bratanek jego pożyczał dla mnie kolejno wszystkie tomy tego dzieła, obszernego jak dla dziecka, osiemnaście czy dwadzieścia tomów.
1.0	0.0	0.0	0.0	joy	disgust	— Ee... ja by go nie tak zrobił...
1.0	0.0	0.0	0.0	joy	trust	To jest szczera prawda.
1.0	0.0	0.0	0.0	joy	anger	— O co ci tedy chodzi?
1.0	0.0	0.0	0.0	joy	surprise	Lecz ona porwała się z krzesła.
1.0	0.0	0.0	0.0	joy	sadness	Na fotelu, pod którym zaskrzypiała podłoga, siedziała margrabina Crescenzi, której oczy napełnione łzami spotkały się wprost z oczami Fabrycego, również w nielepszym stanie.
1.0	0.0	0.0	0.0	joy	joy	— zawołał Tomek uradowany i pomyślał z niejakim zadowoleniem:
1.0	0.0	0.0	0.0	joy	anticipation	Naprawdę, wielką bym miał ochotę ubrać Formińskiego w kos­tium Iksa, a dla redaktora Panoramy Tygodnia.
1.0	0.0	0.0	0.0	joy	disgust	To wstyd!
1.0	0.0	0.0	0.0	joy	sadness	Dwaj przepadli bez śladu...
1.0	0.0	0.0	0.0	joy	trust	Bóg mu to dał, bo zasłużył; złota była to dusza, wszystkich dobrych ludzi kochał serdecznie, a twarz to miał taką, jak aniołek.
1.0	0.0	0.0	0.0	joy	anticipation	Cyrus Smith i jego towarzysze stali na szczycie góry przez blisko godzinę.
1.0	0.0	0.0	0.0	joy	anger	Zacisnęła ręce.
1.0	0.0	0.0	0.0	joy	joy	Rozbawiona Łucja śmiała się bez przymusu.
1.0	0.0	0.0	0.0	joy	trust	Nie sprzeciwiała się.
1.0	0.0	0.0	0.0	joy	anticipation	Przeciera oczy, poprawia włosy — zaraz do okna.
1.0	0.0	0.0	0.0	joy	fear	Był mężczyzną, a czuł się bezsilnym w obec losu.
1.0	0.0	0.0	0.0	joy	neutral	— odrzekli Kosma i Damian.
1.0	0.0	0.0	0.0	joy	trust	Który chcesz — bierz.
1.0	0.0	0.0	0.0	joy	neutral	Jeden zaprząg na samym końcu orszaku całkiem był nie przysypany.
1.0	0.0	0.0	0.0	joy	surprise	— Znowu waha się pan?
1.0	0.0	0.0	0.0	joy	anticipation	Lecz zanim je opowiem, chciałabym wiedzieć, czy w istocie między nami znajduje się najwspanialszy rycerz Don Kichot z Manchy i najznakomitszy jego giermek, Sancho Pansa?
1.0	0.0	0.0	0.0	joy	trust	Dżek wybrał drogę najwłaściwszą.
1.0	0.0	0.0	0.0	joy	anticipation	Może zapalisz cygaro?
1.0	0.0	0.0	0.0	joy	anticipation	Jakże rozkosznie byłoby usłyszeć wyznanie jego prawdziwych uczuć!
1.0	0.0	0.0	0.0	joy	anger	— Krew cię ujdzie!
1.0	0.0	0.0	0.0	joy	joy	— To, to, mój oficerze!
1.0	0.0	0.0	0.0	joy	anger	Nie każdy ma czarnych niewolników, książęce galerie, broń damasceńską, konie po sześć tysięcy franków, grecką kochankę!
1.0	0.0	0.0	0.0	joy	trust	— To jest wielki przyjaciel Andrzeja i prawie nasz domownik.
1.0	0.0	0.0	0.0	joy	trust	Od razu i niezłomnie uwierzyła w miłą sobie wiadomość, przyjęła ją nawet bez zdziwienia, jak coś, czego spodziewała się zawsze i co koniecznie stać się musiało.
1.0	0.0	0.0	0.0	joy	surprise	Przecież bardzo długo mnie nie widziała.
1.0	0.0	0.0	0.0	joy	surprise	— Dziwi się pani?
1.0	0.0	0.0	0.0	joy	sadness	Dwa dni zimno trzęsie, kości bolą, że jęczysz, w głowie szumi, a kaszel, zdaje się, piersi rozrywa.
1.0	0.0	0.0	0.0	joy	surprise	— A ty tu znowu, Brühl?
1.0	0.0	0.0	0.0	joy	surprise	Młodzieniec stał zadumany u drzwi, gdy poczuł że go ktoś zlekka za suknię pociąga i odwróciwszy się ujrzał O. Maura, który z chóru go zobaczywszy, przybył powitać.
1.0	0.0	0.0	0.0	joy	neutral	— rzekła.
1.0	0.0	0.0	0.0	joy	anticipation	— A zwleczesz się?
1.0	0.0	0.0	0.0	joy	neutral	De Polewkarum usu et honestate łykandi per Silvestrem Prieratem, Jacobinum.
1.0	0.0	0.0	0.0	joy	trust	— Bógże ci zapłać, bo mi będzie starość lżejsza.
1.0	0.0	0.0	0.0	joy	surprise	Kapitanowie, którzy wysiedli później na ląd, opowiadali o dziwacznej wyprawie nieznajomych i wypytywali, kim są ci dwaj antypatyczni wariaci, rozbijający się w szalupie za jakimś mężczyzną i jakąś kobietą i rozpowiadający historię, z której nic nie można było wyrozumieć.
1.0	0.0	0.0	0.0	joy	joy	W pobliskim kościele klasztornym podziwiał na obrazach i relikwiarzach owe przecudne skamieniałe światła i pragnął bardzo w duszy, by doń przemówiły i wyznały mu tajnię swego pochodzenia.
1.0	0.0	0.0	0.0	joy	fear	Następnie były tam i wizyty mniej przyjemne, rozeszła się bowiem wieść kilkakrotnie, że chciano kardynała zamordować.
1.0	0.0	0.0	0.0	joy	anticipation	— Dlaczego?
1.0	0.0	0.0	0.0	joy	sadness	Szedłem w owe straszliwe upały szukać cienia i trochę chłodu pod wielkimi kasztanami w Tuileriach. „ Skoro nie mogę zapomnieć, czy nie lepiej byłoby zabić się? ” — powiadałem sobie.
1.0	0.0	0.0	0.0	joy	neutral	Do obiadu siadało osiemnaście osób, a w razie potrzeby i dwadzieścia mogłoby się pomieścić w sali jadalnej; ale z rana tylko siedmiu stałych mieszkańców schodziło się na śniadanie i wtedy można by pomyśleć, że to kółko rodzinne zasiada przy stole.
1.0	0.0	0.0	0.0	joy	sadness	O je! jak boli!
1.0	0.0	0.0	0.0	joy	neutral	Przed każdą stała miseczka z jarzynami, czarka z wodą, a obok leżała kromka chleba.
1.0	0.0	0.0	0.0	joy	sadness	I wyrzekłszy się Marji, czuł taki żal, taką rozpacz po niej, że wracał jeszcze, mówił znowu — kocham Marję.
1.0	0.0	0.0	0.0	joy	anger	Jać wam służę... a chcecie zbyć mnie psim swędem... niedoczekanie!
1.0	0.0	0.0	0.0	joy	trust	— W domu ci je pokażę, kobieto — odpowie Sancho — trochę cierpliwości miej teraz, a za Bożą pomocą mam nadzieję, że ruszymy jeszcze raz na wyprawę i jak wrócę, zobaczysz mnie hrabią albo władcą wyspy, ale to wyspy co się nazywa, wyspy porządnej, lądowej, nie takiej tam, co to tuzinami po morzu się walają.
1.0	0.0	0.0	0.0	joy	joy	Przed jakimś Teniersem przywdziewał kaftan żołnierski lub siermięgę robotnika; pragnął nosić brudną i zadymioną czapkę Flamandów, zapijał się piwem, grał z nimi w karty i uśmiechał się do tęgiej wieśniaczki o soczystych kształtach.
1.0	0.0	0.0	0.0	joy	anticipation	Przez cały obiad prawie się nie odzywał, tylko z chciwością chwytał ich spojrzenia i słowa, śledził uśmiechy, słuchał ze skupieniem, ale nie mógł złapać nic podejrzanego, bo w ich zachowaniu się była tylko wielka przyjacielska zażyłość, pełna szacunku i życzliwości.
1.0	0.0	0.0	0.0	joy	surprise	— Doprawdy?
1.0	0.0	0.0	0.0	joy	sadness	Stał nad rynsztokiem i zalewał się łzami, bo jakieś auto ochlapało go błotem.
1.0	0.0	0.0	0.0	joy	neutral	Potem wędrowcy musieli piąć się stromą percią, zawianą śniegiem, biegnącą po upłazie Snipy, a dopiero poza tym rozpoczynała się jaka taka droga.
1.0	0.0	0.0	0.0	joy	anger	Więc jest źle!
1.0	0.0	0.0	0.0	joy	neutral	Przyjeżdżał do niego w odwiedziny każdego lata.
1.0	0.0	0.0	0.0	joy	surprise	— Kto to?...
1.0	0.0	0.0	0.0	joy	anticipation	— pytał dalej Kmicic.
1.0	0.0	0.0	0.0	joy	neutral	Grzegorz podszedł do króla.
1.0	0.0	0.0	0.0	joy	surprise	A ten malec czego się tu plącze?
1.0	0.0	0.0	0.0	joy	trust	— Przyjedź znowu do nas niezadługo, Jakubie — rzekł leśniczy, ściskając mu serdecznie rękę — do nas, mówię, to znaczy i do mnie także.
1.0	0.0	0.0	0.0	joy	surprise	„ Do licha, czyżbym ją obraził?...
1.0	0.0	0.0	0.0	joy	surprise	— Cóż ja robię?...
1.0	0.0	0.0	0.0	joy	disgust	Szczególną antypatią, nienawiścią, odrazą, wzgardą i drwinami Lulek darzył miejscową organizację socjalistyczną z odcieniem narodowym.
1.0	0.0	0.0	0.0	joy	joy	Nie zapomnę nigdy wrażenia pierwszej pod gołym niebem spędzonej nocy.
1.0	0.0	0.0	0.0	joy	surprise	— Na Boga!
1.0	0.0	0.0	0.0	joy	joy	Uśmiechnął się i dodał:
1.0	0.0	0.0	0.0	joy	anticipation	Co on ci mówił?
1.0	0.0	0.0	0.0	joy	sadness	Było to posępne i tragiczne, i prawdziwe!
1.0	0.0	0.0	0.0	joy	neutral	Na zasłonie była wyhaftowana złotem skrzydlata kula z dwoma wężami.
1.0	0.0	0.0	0.0	joy	neutral	Takich jest miliony.
1.0	0.0	0.0	0.0	joy	surprise	— Powinno się okazać polepszenie; co by to była za chorość?
1.0	0.0	0.0	0.0	joy	neutral	Bardzo charakterystyczne, na wskroś typowe.
1.0	0.0	0.0	0.0	joy	sadness	Szkoda, że mojej żony niema...
1.0	0.0	0.0	0.0	joy	anger	— Tylko buntownicy nie spełnią rozkazów faraona — odparł Ramzes.
1.0	0.0	0.0	0.0	joy	joy	— Dzięki Bogu.
1.0	0.0	0.0	0.0	joy	anger	— I obu was się nie zlęknę! zaryczał Arnulf zrywając się z ławy.
1.0	0.0	0.0	0.0	joy	sadness	Nieszczęśliwi mają pewne prawa... a ja, panie szanowny, jestem bardzo nieszczęśliwa.
1.0	0.0	0.0	0.0	joy	joy	I ją poniesły radoście, że pobiegła naprzeciw i prawie pierwsza chłopów dopadła, a nikto do niej nie wyskoczył, nikto nie przytulił i nie całował.
1.0	0.0	0.0	0.0	joy	surprise	Wszedł jako czwarty dependent do Derville’a, a był już drugim dependentem w 1819!
1.0	0.0	0.0	0.0	joy	joy	Na trzecim piętrze zapukał do drzwi, przez które dolatywał wesoły śmiech i krzyki dzieci.
1.0	0.0	0.0	0.0	joy	disgust	Mędrzec dążący do władzy winien snobizm ( w języku polskim kołtunizm, czyli kołtuństwo ) uczynić najistotniejszą częścią swego „ programu ”, dać kołtuństwu możność rozkwitu, nazwać kołtun najpiękniejszymi naukowymi nazwami i popierać go entuzjastycznie.
1.0	0.0	0.0	0.0	joy	joy	— zawołał ten ostatni, pozwalając ocałowywać sobie policzki — twoja wieczerza, mój bracie, jest pyszną rzeczą na dzisiejszą zawieruchę!
1.0	0.0	0.0	0.0	joy	surprise	— Więc to wszystko prawda — wyrzekła.
1.0	0.0	0.0	0.0	joy	anger	— Czy mi nawet tego robić nie wolno!
1.0	0.0	0.0	0.0	joy	sadness	Porozstawiane naczynia od herbaty i ciastka, dalej owa maszynka — wszystko zaczęło drobiazgami okrutnymi ranić jej serce.
1.0	0.0	0.0	0.0	joy	surprise	A cóż się z nią stało?
1.0	0.0	0.0	0.0	joy	surprise	Zdaje mi się, że oczy jéj w mgnieniu oka kilka razy zmieniły kolor: były i piwne, i ciemno-zielone, i czarne jak węgiel.
1.0	0.0	0.0	0.0	joy	sadness	Jakkolwiek stłumione, płacz i jęki musiały znać dojść do uszu matki, która od drugiego pokoju drzwi uchyliła, naprzód powoli, a potem rzuciwszy niemi, nie patrząc na króla, do córki przypadła, tuląc ją ku sobie.
1.0	0.0	0.0	0.0	joy	surprise	Jeszcze ci nie dosyć?
1.0	0.0	0.0	0.0	joy	surprise	— Borynowy to dom, Macieja Boryny?
1.0	0.0	0.0	0.0	joy	trust	Niech was Bóg prowadzi i odprowadza.
1.0	0.0	0.0	0.0	joy	anger	— Wytłumacz to wyborcom!
1.0	0.0	0.0	0.0	joy	trust	— Bądź pani spokojna — rzecze Don Kichot — nie powiem nic już więcej i nie wmieszam się do niczego, dopóki nie dopełnię swojej obietnicy.
1.0	0.0	0.0	0.0	joy	joy	— Niech żyje Carlini!
1.0	0.0	0.0	0.0	joy	surprise	— Co znaczy za kim?
1.0	0.0	0.0	0.0	joy	disgust	Hoyma oburzała i treść jéj słów, a nadewszystko zimna krew, obojętność z jaką je wymawiała.
1.0	0.0	0.0	0.0	joy	surprise	A o ilu ja rzeczach nie myślałem przed chwilą i o ilu nie myślę?
1.0	0.0	0.0	0.0	joy	sadness	Zdało mi się, że nie mam co robić między nimi, biedny prostak, i już nawet nie patrząc na nich, chcę ich minąć i iść dalej w las, kiedy słyszę, jak jeden z nich woła:
1.0	0.0	0.0	0.0	joy	neutral	Przede wszystkim zrobiłem sobie stożkowate nakrycie głowy z długowłosej skóry lamy, nie przepuszczającej deszczu.
1.0	0.0	0.0	0.0	joy	neutral	Gospoda na gościńcu pod lasem stała w miejscu kędy przejazd był znaczny do Poznania.
1.0	0.0	0.0	0.0	joy	disgust	Brwi zrośnięte nad nosem oszpeconym ospą.
1.0	0.0	0.0	0.0	joy	joy	Komendant roześmiał się.
1.0	0.0	0.0	0.0	joy	neutral	— spytał.
1.0	0.0	0.0	0.0	joy	surprise	Nagle wśród chwilowej ciszy zza drzwi gabinetu doleciał podniesiony głos Dyzmy:
1.0	0.0	0.0	0.0	joy	trust	Dyzma przyznał pułkownikowi rację.
1.0	0.0	0.0	0.0	joy	surprise	Przy samej bramie Agnieszka spostrzegła, że zostawiła u doktora koszyczek od roboty.
1.0	0.0	0.0	0.0	joy	neutral	Szczur zarzucił lejce na grzbiet konia, związał je i ujął szkapę przy pysku.
1.0	0.0	0.0	0.0	joy	sadness	— Straciłem tam syna...
1.0	0.0	0.0	0.0	joy	joy	Rad był z wyjazdu Kmicica.
1.0	0.0	0.0	0.0	joy	neutral	Takich generałów miała Austria bardzo wielu.
1.0	0.0	0.0	0.0	joy	anger	Mów!
1.0	0.0	0.0	0.0	joy	surprise	— Nie skarżę się na was, broń Boże!
1.0	0.0	0.0	0.0	joy	surprise	Dla niego było to coś niepojętego, co go więcej dziwiło niż nęciło — studyum teratologiczne.
1.0	0.0	0.0	0.0	joy	joy	Ho, ho, idźże do Poświcia, i szczęść ci, Boże!
1.0	0.0	0.0	0.0	joy	neutral	„ Kopernik ”.
1.0	0.0	0.0	0.0	joy	neutral	— myślał Winicjusz.
1.0	0.0	0.0	0.0	joy	surprise	Instynktowi życia samego już nieufny?
1.0	0.0	0.0	0.0	joy	joy	Pomimo całej biedy, jaka nawiedziła dżunglę, zwierzęta — nie wyłączając Hathiego — nie mogły powstrzymać się od rzęsistego śmiechu, posłyszawszy te słowa.
1.0	0.0	0.0	0.0	joy	surprise	— Za co mieliby nas upominać?
1.0	0.0	0.0	0.0	joy	neutral	Na nogach ciżemki żółte.
1.0	0.0	0.0	0.0	joy	anger	— Ty głupi jesteś!
1.0	0.0	0.0	0.0	joy	neutral	—
1.0	0.0	0.0	0.0	joy	neutral	Własne to twoje oblicze na chropowatym i niedoskonałym zwierciadle.
1.0	0.0	0.0	0.0	joy	neutral	﻿Pewnej nocy, patrolując po mieście, schwytałem młodą panienkę nadzwyczaj piękną, przebraną za chłopca i jej brata, przebranego za dziewczynę.
MCosD: 0.9714285714285714
MAE: 1.2356508579175662
RMSE: 1.3532310434389805
PREC: 0.1385390428211587
RECALL: 0.1385390428211587
FSCORE: 0.1385390428211587
ACC: 0.1385390428211587
