1.0	0.0	0.0	0.0	joy	sadness	Przygnębiony ciężarem sumienia, zawstydzony wzrok wlepił w ziemię.
1.0	0.0	0.0	0.0	joy	surprise	— Ale, ale!...
1.0	0.0	0.0	0.0	joy	sadness	Od wieków tak bardzo odosobieni, samotni, nie żyjąc z nikim, rodziną się tylko własną i sami sobą otaczając starczyli sobie, ani z sąsiadami, ani z tymi do których wypadki ich zbliżały nie zawiązując ściślejszych stosunków.
1.0	0.0	0.0	0.0	joy	surprise	Nie wspomniał nic o warunkach, pod jakimi ochotnicy zgodzili się na tę naukę.
1.0	0.0	0.0	0.0	joy	anticipation	Zapatrzyła się w rękę.
1.0	0.0	0.0	0.0	joy	anticipation	Słucham was, panie von Bergow.
1.0	0.0	0.0	0.0	joy	anticipation	— Nie zaraz odbędzie się tyle przeze mnie upragniona uroczystość.
1.0	0.0	0.0	0.0	joy	anger	— Ach, gdyby wiedzieli — mówił z gniewem władca — jak faraon jest bezsilny i ubogi, każdy nomarcha zechciałby być panem swego nomesu!...
1.0	0.0	0.0	0.0	joy	sadness	Śmiech jej krył wzruszenie, które mi sprawiło ból.
1.0	0.0	0.0	0.0	joy	trust	— Będę się wpatrywał w plamy atramentowe... będę wiernie pilnował klejnotów!
1.0	0.0	0.0	0.0	joy	fear	— Kto pan jesteś? czego tu chcesz?...
1.0	0.0	0.0	0.0	joy	fear	— Bój się Boga, Senderl!
1.0	0.0	0.0	0.0	joy	anticipation	— Ależ chcę wiedzieć...
1.0	0.0	0.0	0.0	joy	anticipation	Padre Torquemada stał przy oknie zamyślony, na koniec odwrócił się i podszedł do stołu.
1.0	0.0	0.0	0.0	joy	trust	Zrozumiałaś mnie.
1.0	0.0	0.0	0.0	joy	anticipation	— Marku, a Drakecity?
1.0	0.0	0.0	0.0	joy	neutral	Byłto młody chłopak z jasnemi włosy, skromnie, ale czysto odziany, wyglądający na leśniczego lub pisarza, z torbą myśliwską na plecach, w czarnych, długich po kolana butach, z harapnikiem przez plecy, w wiejskim kapeluszu słomianym na głowie.
1.0	0.0	0.0	0.0	joy	surprise	Mówcie, którzy stąd jesteście: prawda-li to?
1.0	0.0	0.0	0.0	joy	anticipation	Co?
1.0	0.0	0.0	0.0	joy	anticipation	To pewnie i gazety pisze?
1.0	0.0	0.0	0.0	joy	sadness	Innym znów razem, w dzień chłodny płukać musiała wraz z praczkami bieliznę nad brzegiem jeziora.
1.0	0.0	0.0	0.0	joy	anger	Tyś go zabił — podchwycił sędzia.
1.0	0.0	0.0	0.0	joy	anticipation	— zapytała.
1.0	0.0	0.0	0.0	joy	anger	— mruknął stary ze złością i, nie skończywszy obiadu, wyszedł, a Janka była w takiem usposobieniu, że aby mu zrobić więcej przykrości, kazała koniom czekać przed dworem całe dwie godziny, i z pewną przyjemnością widziała, że stary kilka razy wyglądał z oficyny na podjazd, klął głośno na marnowanie czasu i na jaśnie państwo, i, nie mogąc wkońcu wytrzymać, krzyknął na stangreta:
1.0	0.0	0.0	0.0	joy	disgust	Wolałby jednak pozostać w domu i czytać tę książkę, niżeli iść na wieczór do baronowej, gdzie nie znajdzie najpewniej nic nowego, ani szczególnie przyjemnego.
1.0	0.0	0.0	0.0	joy	sadness	Nadeszła chwila, że tłumione łkanie wstrząsnęło te rycerskie piersi.
1.0	0.0	0.0	0.0	joy	fear	Oto szczepienie będzie spóźnione, oto profesor będzie umierał w najstraszliwszych, w najdzikszych męczarniach.
1.0	0.0	0.0	0.0	joy	joy	Nie znam w istocie szczęśliwszego małżeństwa.
1.0	0.0	0.0	0.0	joy	joy	Oswald w jego wieku znał się nawet na zegarze słonecznym.
1.0	0.0	0.0	0.0	joy	sadness	Mąż zabity, syn uległ wypadkowi, córka pod ziemią, może już martwa, a w dodatku chory starzec, dziecko okaleczałe skutkiem wypadku i wreszcie córka zmarła z głodu podczas strajku.
1.0	0.0	0.0	0.0	joy	anticipation	Dowiedź tego!
1.0	0.0	0.0	0.0	joy	sadness	Wyrwał ze złoconych ram portret matki i zwinął go; w złotych ramach pozostała czarna pustka.
1.0	0.0	0.0	0.0	joy	anticipation	Kanclerz państwa i inni dopraszali się, aby Władysław niezwłócząc udał się do Szegedynu, gdzie posłowie tureccy przybyć mieli.
1.0	0.0	0.0	0.0	joy	anger	— Słuchaj — rzekł zniecierpliwiony tem do Fotofera, przybyłego w odwiedziny jednego poranku, jak to może być żebym ja się dał temu Włochowi pokonać i odszedł z niczem.
1.0	0.0	0.0	0.0	joy	surprise	Pierwszy raz to we wsi czy co!
1.0	0.0	0.0	0.0	joy	disgust	Ciało: to szatan, to złość, to niedoskonałość, zgnilizna i robactwo; duch jedyną prawdą.
1.0	0.0	0.0	0.0	joy	surprise	— Przysięgam, że tego po tobie się nie spodziewałem.
1.0	0.0	0.0	0.0	joy	sadness	Tak nad niemi pochyloną z boku schwyciła pantera, drasnęła ją ledwie, i piękna jej główka jak zwiędły kwiat pochyliła się blada, prawie bez śmiertelnego wysiłku...
1.0	0.0	0.0	0.0	joy	anger	Nie!
1.0	0.0	0.0	0.0	joy	surprise	— Aa?!...
1.0	0.0	0.0	0.0	joy	neutral	Historja wahającego się oblubieńca i zerwanego małżeństwa może temu odpowiadać, jak recenzja rozsądnego dziennikarza może dać treść sztuki Ibsena.
1.0	0.0	0.0	0.0	joy	anticipation	— Czy powiedział coś?
1.0	0.0	0.0	0.0	joy	anger	Z przyjemnością rzuciłabym mu wprost w twarz, że Halszka go nienawidzi.
1.0	0.0	0.0	0.0	joy	anger	— Idź do diabła!
1.0	0.0	0.0	0.0	joy	sadness	Znów siedział w milczeniu, strasznie tęsknym wzrokiem patrząc w dal, jakby szukając tej zmarnowanej okazji odznaczenia się; rozwarte nozdrza zdawały się chwytać upajającą woń tej zmarnowanej sposobności.
1.0	0.0	0.0	0.0	joy	neutral	— Już go raz słyszałem.
1.0	0.0	0.0	0.0	joy	neutral	Mnie zaraz powiedziała, jako było.
1.0	0.0	0.0	0.0	joy	neutral	Po nabożeństwie odbyło się zebranie rady kościelnej.
1.0	0.0	0.0	0.0	joy	joy	— ozwał się Kim, parskając śmiechem, a oczy mu się zaświeciły.
1.0	0.0	0.0	0.0	joy	fear	Na miły Bóg, bądź ostrożna!
1.0	0.0	0.0	0.0	joy	sadness	I sam ten człowiek, gdyby nawet był wolny, nie byłby zdolny do poważnego przywiązania, gdy ona — czuła to dobrze — potrafiłaby w życiu kochać tylko raz.
1.0	0.0	0.0	0.0	joy	neutral	— Nie wiem, panie dyrektorze.
1.0	0.0	0.0	0.0	joy	anticipation	— Gotów nieboszczyk?...
1.0	0.0	0.0	0.0	joy	anger	Puść mnie, wolnym chcę być!
1.0	0.0	0.0	0.0	joy	sadness	— Bóg widzi, że moja hardość została za bramą tutejszą.
1.0	0.0	0.0	0.0	joy	anticipation	Weźcie mnie z sobą.
1.0	0.0	0.0	0.0	joy	sadness	Lampka żółtym cieniem spowija izbę suteryny, jej ubogie sprzęty i znużone świętem twarze mieszkańców.
1.0	0.0	0.0	0.0	joy	fear	A kiedy wyszła z pierwszego osłupienia, gdy jeden rok i drugi minął głucho, czuła niepokój w głębi piersi, jakby trzepotanie źle związanych skrzydeł.
1.0	0.0	0.0	0.0	joy	anger	— Och, daj spokój!
1.0	0.0	0.0	0.0	joy	neutral	— panem dziedzicem Nawłoci z przyległościami.
1.0	0.0	0.0	0.0	joy	sadness	—... Odszedłeś od nas — wołały płaczki — nie ma cię, panie... osierociłeś nas biednych...
1.0	0.0	0.0	0.0	joy	joy	Anna ocknęła się, wzruszona serdecznością Franciszka.
1.0	0.0	0.0	0.0	joy	joy	Mason aż pozieleniał z radości.
1.0	0.0	0.0	0.0	joy	anticipation	— Domyślałam się — powiedziała — że na coś się zanosi, chociaż Sämund nic mi nie powiedział.
1.0	0.0	0.0	0.0	joy	trust	Gdybym miał ciebie tego dnia, licytowałbym wyżej i utrzymałbym się przy kupnie.
1.0	0.0	0.0	0.0	joy	surprise	— Nie wiedziałem, że się interesujesz zoologią.
1.0	0.0	0.0	0.0	joy	neutral	Pojadę do Szczytna.
1.0	0.0	0.0	0.0	joy	neutral	Bernard obojętnie podniósł ramiona.
1.0	0.0	0.0	0.0	joy	trust	— Co komu Pan Bóg przeznaczył, to go i tak nie minie — odparł Litwin.
1.0	0.0	0.0	0.0	joy	sadness	Teraz dopiero z setek i tysięcy szczegółów układałem w sobie obraz zmarłej, ów obraz, który mi wszędzie towarzyszy.
1.0	0.0	0.0	0.0	joy	fear	I przerażona czuje, że serce jej tłuc się zaczyna jak ptak w klatce.
1.0	0.0	0.0	0.0	joy	surprise	— Skąd tak idziesz?
1.0	0.0	0.0	0.0	joy	trust	Bogu polecam moje dzieci!
1.0	0.0	0.0	0.0	joy	sadness	Może życie niczego więcej nie warte!
1.0	0.0	0.0	0.0	joy	surprise	— A nie chceszli wyspowiadać się przed drogą?
1.0	0.0	0.0	0.0	joy	joy	I widząc, że ciotka naprawdę nie wie, co znaczy piszczyk, aby mieć przyjemność okazania, że jest w równym stopniu wykształcona jak purystka, i aby zadrwić z ciotki, zadrwiwszy poprzednio z pani de Cambremer, rzekła na wpół ze śmiechem, powściąganym przez resztki udanego złego humoru:
1.0	0.0	0.0	0.0	joy	disgust	Lekkie szyderstwo brzmiało w jego głosie.
1.0	0.0	0.0	0.0	joy	anger	Niechże się ów komtur przekona, że nie twoja zapalczywość, ale nasze prawa karzą śmiercią za porwanie się na osobę posła.
1.0	0.0	0.0	0.0	joy	surprise	Czy to miał być protest?
1.0	0.0	0.0	0.0	joy	anticipation	Staś przyszedł do pokoju zawiadowcy i czekał, bo Orłowski chodził wzdłuż pokoju, spoglądał w dwa okna peronu, to przez okienko kasowe, wychodzące na korytarz, wychylał głowę i nasłuchiwał.
1.0	0.0	0.0	0.0	joy	anger	— Utaił by się przed innemi, nie przedemną!
1.0	0.0	0.0	0.0	joy	sadness	Bito nas nie patrząc gdzie.
1.0	0.0	0.0	0.0	joy	joy	— Ach, dobrze, żem se spomniał!
1.0	0.0	0.0	0.0	joy	anger	— Po cóż ja ciebie urodziiiłam!...
1.0	0.0	0.0	0.0	joy	surprise	Nie?
1.0	0.0	0.0	0.0	joy	anticipation	— Więc zrobi pani, o co prosiłem?...
1.0	0.0	0.0	0.0	joy	surprise	— spytał Harvey, nie mogąc jeszcze sobie uprzytomnić, że jego życie było najzupełniej bezpieczne.
1.0	0.0	0.0	0.0	joy	surprise	— Ale jak ty zrozumiesz tę ich mowę?
1.0	0.0	0.0	0.0	joy	anticipation	— Cóż będziesz robił po obiedzie?
1.0	0.0	0.0	0.0	joy	disgust	Dał Maciuś dzieciom prawa i patrzcie, co zrobiły.
1.0	0.0	0.0	0.0	joy	fear	A wtem na krańcach, gdzie niebo zdawało się stykać z ziemią i rozciągały się mgły sinawe, w tych mgłach właśnie zamajaczało coś i poczęło się poruszać, wypełzały jakieś kształty, z początku mętne, które zwierając się stopniowo, stawały się coraz wyraźniejsze.
1.0	0.0	0.0	0.0	joy	neutral	— wołał Pantera.
1.0	0.0	0.0	0.0	joy	joy	Nareszcie otwarły się drzwiczki do numeru Płazy-Spławskiego, nareszcie światło...
1.0	0.0	0.0	0.0	joy	neutral	W Dobromilu, na etapie w kancelarii, zapisywano wszystkich jeńców jednego po drugim, co odbywało się nie bez trudu, ponieważ wśród wszystkich trzystu jeńców, spędzonych do Dobromila z różnych stron, nie było ani jednego, który rozumiałby mowę rosyjską sierżanta siedzącego za stołem i pełniącego obowiązki tłumacza we Wschodniej Galicji, bo twierdził o sobie, że język rosyjski zna.
1.0	0.0	0.0	0.0	joy	surprise	— Zwaryowałeś?
1.0	0.0	0.0	0.0	joy	anticipation	Dołożycie starań, aby wcisnąć się do rozmównicy jakiegoś klasztoru; ploteczki tych pustelnic nie będą dla nas bez pożytku.
1.0	0.0	0.0	0.0	joy	surprise	— Jak to?
1.0	0.0	0.0	0.0	joy	surprise	Rózia postrzegła tylko mundur i przelękła się, sądząc że w mieszkaniu Juljana robić będą rewizyą, ale w chwili gdy ta myśl po jéj główce przebiegła, poznała w zbliżającym się kniazia z bukietem w ręku i pudełkiem cukierków.
1.0	0.0	0.0	0.0	joy	neutral	Tak rozmawiając, zbliżyli się do Krakowa.
1.0	0.0	0.0	0.0	joy	surprise	Czy kto uwierzy, iż są takie domy?
1.0	0.0	0.0	0.0	joy	surprise	Jest pełna!
1.0	0.0	0.0	0.0	joy	anticipation	Rozkazał pracować i ochraniać od złego ile w mej mocy i oddać temu tylko, kto, oprócz urzędowej legitymacyi, przyniesie mi znak umówiony z przyjacielem.
1.0	0.0	0.0	0.0	joy	anticipation	Podróżny podjechał bliżej, a na orszak skinął, dając znak, żeby na niego zaczekał.
1.0	0.0	0.0	0.0	joy	disgust	Słowo Niemca to fałsz...
1.0	0.0	0.0	0.0	joy	surprise	— A to, synku, zapomniałeś, że ci przybył jeszcze jeden obowiązek?
1.0	0.0	0.0	0.0	joy	fear	Ale gdy tak mówiła, drwiące jej oczy lśniły tak żywo, że książę nie mógł ich znieść; spojrzał na sufit, co było u niego ostatecznym znakiem krańcowego zakłopotania.
1.0	0.0	0.0	0.0	joy	anticipation	Wielki, choć z całej siły tłumiony gwałt pożądania był w tych prośbach...
1.0	0.0	0.0	0.0	joy	surprise	Czyż pan nie wie, że przynajmniej raz na miesiąc Jagoda podaje się do dymisji.
1.0	0.0	0.0	0.0	joy	disgust	— Wcale nie samotnych.
1.0	0.0	0.0	0.0	joy	joy	— Mój ojcze!
1.0	0.0	0.0	0.0	joy	sadness	Wokulski czuł, że ten mrok, żal i smutek wypływał z jego serca i że to wszystko zakończy się chyba z życiem, jeżeli się zakończy...
1.0	0.0	0.0	0.0	joy	trust	Komu jest dobrze, temu się widzi, że wszystko się dzieje na świecie, jak przynależy, jak Pan Bóg przykazał!
1.0	0.0	0.0	0.0	joy	surprise	W pierwszej chwili sądziłem, że to intryga miłosna.
1.0	0.0	0.0	0.0	joy	anticipation	— spytałem go, kiedyśmy wyszli na ganek, — nie mając już siły powstrzymać tych słów, co od godziny prawie paliły mi wargi.
1.0	0.0	0.0	0.0	joy	anticipation	— Jutro, lub dziś nawet.
1.0	0.0	0.0	0.0	joy	fear	A jak okaże się, że komitet zbyt pośpiesznie wydał rozkaz egzekucji?
1.0	0.0	0.0	0.0	joy	disgust	— Potworny jest — rzekła.
1.0	0.0	0.0	0.0	joy	disgust	Doprawdy, nadto jest pewny siebie.
1.0	0.0	0.0	0.0	joy	sadness	Na mnie spada cała ich złość dlatego, że ja was bronię z narażeniem moich dóbr w Neapolitańskiem, siebie...
1.0	0.0	0.0	0.0	joy	anticipation	Postrzegłszy to, pan Michał pociągnął wszystkich ze sobą do bramy, aby się wjeżdżającym przypatrywać.
1.0	0.0	0.0	0.0	joy	trust	No, a cmentarz! widzicie, że mi nic nie zaszkodził, to i wam przy mnie nicby się nie stało...
1.0	0.0	0.0	0.0	joy	disgust	Jeszcze tak nie jest, ale on z dniem każdym jest tłuściejszy.
1.0	0.0	0.0	0.0	joy	anger	Chce podobać się Solskiemu, a bałamuci innych!
1.0	0.0	0.0	0.0	joy	joy	Jaka ta Laura szczęśliwa ze swoim wiecznym spokojem!
1.0	0.0	0.0	0.0	joy	anticipation	Przez ustalenie jego tożsamości można będzie wykryć, z kim oskarżony miał do czynienia, a także będzie można poznać jego współwinnych.
1.0	0.0	0.0	0.0	joy	sadness	Chybaż on się powiesi — ów Bohun — ale już jemu czarownica przepowiadała, że on tej, o której myśli, nigdy nie dostanie i że Lach ją posiędzie, a ten Lach to pewnie jegomość.
1.0	0.0	0.0	0.0	joy	joy	Za każdym razem, kiedy chodziłem się odlać za te lipy na końcu ogrodu, dusza moja czuła się odświeżona widokiem tych przyjaciół.
1.0	0.0	0.0	0.0	joy	neutral	Rejentka lekko skinęła głową i rzekła do Ajdara:
1.0	0.0	0.0	0.0	joy	neutral	A wtedy ojciec mój powtórzył:
1.0	0.0	0.0	0.0	joy	fear	Suknia, kapelusz, okrywka i parasolka, wszystko musi być nowe, a tu tak niewiele czasu i nie tylko nic nie zamówione, ale nawet nie wybrane!...
1.0	0.0	0.0	0.0	joy	anticipation	— Wiesz, dziecko, że ojciec sam chce mówić z panem...
1.0	0.0	0.0	0.0	joy	anticipation	— Staram się wejść w położenie tego przemysłowca.
1.0	0.0	0.0	0.0	joy	trust	Godzę się z losem.
1.0	0.0	0.0	0.0	joy	anticipation	Gdyby ów młody człowiek zjawił się za naszych szczęśliwych dni, gdyby przyniósł Brygidzie jakiś obojętny list, czyż byłbym nań zwrócił jaką bądź uwagę?
1.0	0.0	0.0	0.0	joy	joy	W tej chwili pani Flora przystąpiła do nich, śmiejąc się na całe swoje puszyste gardziołko.
1.0	0.0	0.0	0.0	joy	anticipation	Uklękła i pociągnęła go, aby uczynił to samo.
1.0	0.0	0.0	0.0	joy	neutral	Zawiadowca, skoro tylko mu tamten zniknął z oczu powrócił do kancelaryi i zajął się załatwianiem urzędowych korespondencyi.
1.0	0.0	0.0	0.0	joy	surprise	Aż się biali królowie sami przestraszyli, że za dużo zabiją.
1.0	0.0	0.0	0.0	joy	anticipation	Ależ on tu nie próżnuje, więc jeszcze idzie naprzód.
1.0	0.0	0.0	0.0	joy	joy	Zdumiony tym niezwykłym objawem uczucia, spojrzał na nią namiętnie; przy śniadaniu wydała mu się bardzo ładna; mimo że miał spuszczone oczy, cały czas rozbierał w myśli jej wdzięki.
1.0	0.0	0.0	0.0	joy	neutral	Podeszła do Morela.
1.0	0.0	0.0	0.0	joy	joy	— Ot, tu jest na to lekarstwo!
1.0	0.0	0.0	0.0	joy	sadness	Petrek głowę spuścił, nie mówił nic.
1.0	0.0	0.0	0.0	joy	anticipation	— Halo, dziewczynko!
1.0	0.0	0.0	0.0	joy	sadness	W izbach, przez które przechodzili, cisza panowała i smutny mrok wieczora je zalegał.
1.0	0.0	0.0	0.0	joy	anticipation	— Panu Braunowi kazałam, by zaraz mi wszystko donosił.
1.0	0.0	0.0	0.0	joy	fear	Strasznie chciało mu się jechać, ale zlazł jak niepyszny i ponieważ mrok już zapadał, poszedł za ogrody odmówić wieczorne pacierze, ale mógł się to zebrać w sobie, kiedy jakaś dzieuszyna piesneczka dzwoniła gdzieś niedaleko i baby rajcowały w jakimś sadzie, że każde słowo leciało po rosie, i wrzeszczały dzieci kąpiące się w stawie, kajś znów śmiechy się zatrzęsły, to ryki krów, to księże perliczki darły się przenikliwie i cała wieś huczała przeróżnymi pogłosami niby ten ul rozbrzęczany, że cięgiem mu się myliło, a gdy nareszcie uchwycił wątek i przyklęknąwszy pod żytem wtopił rozmodlone oczy w to niebo rozgwiażdżone i poniósł duszę kajś w zaświaty, buchnęły od wsi takie przeraźliwe krzyki, lamenta i przeklinania, że poleciał ku domowi wystraszony wielce i niespokojny.
1.0	0.0	0.0	0.0	joy	anger	— zawoła Don Kichot — tu nie czas na żarty, na wszystko jest właściwa pora; teraz nie pora na żarty.
1.0	0.0	0.0	0.0	joy	disgust	Bodajeś nigdy matką nie była!
1.0	0.0	0.0	0.0	joy	anger	Wziął na stronę przyjaciela, i rzekł mu: — Pani Ru ma złe serce!
1.0	0.0	0.0	0.0	joy	anticipation	— Niech pan zaatakuje pierwszy południk.
1.0	0.0	0.0	0.0	joy	fear	Nie mógł mnie przecie nikt zobaczyć w tych łachmanach.
1.0	0.0	0.0	0.0	joy	joy	Mówiła to śpiewnie, z dziwnym upojeniem w głosie, który zdawał się wzbierać i drżeć, jakby chciał więcej powiedzieć, niż te proste słowa wyrażały.
1.0	0.0	0.0	0.0	joy	joy	Cicho, sekretnie pochwalała tę rozpustę nocną, która nareszcie jej duszę uzdrowiła, wyzwoliła, oblała zimną rosą spokoju.
1.0	0.0	0.0	0.0	joy	anger	— A nie obłaskawię, bo i ten będzie jeszcze mój, niech się jeno ciepło zrobi, to już umyśliłem taki sposób na niego, że nie wytrzyma na plebanii, a przyleci!
1.0	0.0	0.0	0.0	joy	fear	Zasypywano pociskami zamek, zasypywano miasto, wszystkie bramy, wszystkie baszty.
1.0	0.0	0.0	0.0	joy	anticipation	— dodał, ja z Neorżą moim powoli sobie radę dam.. jam nie wieczny, ani on...
1.0	0.0	0.0	0.0	joy	fear	— Ja dawniej wiszę — szepnął cicho Andrzej, z jakimś ledwie odczutym akcentem bólu, i twarz mu pobladła, ale oczy natychmiast rozbłysły dawną energją wytrwania i uporu.
1.0	0.0	0.0	0.0	joy	sadness	Ból jego serdeczny coraz bardziej ginął pod uczuciem wstydu, upokorzenia, zranionej miłości własnej.
1.0	0.0	0.0	0.0	joy	sadness	Nie sposób było pisać ni jeść porządnie, słowem sto razy w ciągu dnia brakowało mi tych przedmiotów.
1.0	0.0	0.0	0.0	joy	disgust	— Wracajcie skądeście przyszli.
1.0	0.0	0.0	0.0	joy	sadness	Nie miał nikogo, z kim mógłby, lub chciał podzielić się myślami.
1.0	0.0	0.0	0.0	joy	sadness	Ale zapomniałam o biednych w Sacca!
1.0	0.0	0.0	0.0	joy	joy	O prześlicznie, panie O’Haro!
1.0	0.0	0.0	0.0	joy	surprise	— O!
1.0	0.0	0.0	0.0	joy	surprise	Nagle zadzwoniło, zawirowało.
1.0	0.0	0.0	0.0	joy	surprise	Nie powiadano ci jeszcze?
1.0	0.0	0.0	0.0	joy	fear	Grzmoty zgłuszyły strzelaninę i zataczając się kołem, dudniąc, hucząc, budziły straszne echo w skałach.
1.0	0.0	0.0	0.0	joy	neutral	Toteż wkrótce w wyznaczonym miejscu stanęła walcowata budka, jakby pieprzniczka, nakryta szpiczastym dachem.
1.0	0.0	0.0	0.0	joy	fear	— bełkotał przestraszony, bo Antek puścił kosę i szedł ku niemu blady, ze strasznymi oczami.
1.0	0.0	0.0	0.0	joy	trust	— W jego ręku teraz zbawienie ojczyzny, a że gotów za nią życie oddać, niech mu Bóg błogosławi.
1.0	0.0	0.0	0.0	joy	joy	Radość i zapał błysły w oczach Edmunda i złotnik się oddalił, pozostawiając swego młodego przyjaciela w najrozkoszniejszych oczekiwaniach.
1.0	0.0	0.0	0.0	joy	sadness	Przekazywali sobie osobliwe wieści o pogrzebie wielkiego chana.
1.0	0.0	0.0	0.0	joy	surprise	Ze zdumieniem spostrzegła, że służba zapala nad stołami lampy ze światłem skoncentrowanym.
1.0	0.0	0.0	0.0	joy	joy	— Jesteś dobry i wielki, mój panie — rzekła Hayde, całując dłoń hrabiego — jestem szczęśliwa, że należę do ciebie.
1.0	0.0	0.0	0.0	joy	sadness	— Istny potop — szepnął po chwili, a opierając czoło o szybę, dodał — Ciemno choć oko wykol.
1.0	0.0	0.0	0.0	joy	sadness	Dlatego gdy tamte szczęśliwe... ja umieram z upokorzenia, z tęsknoty, ze wstydu.
1.0	0.0	0.0	0.0	joy	joy	Winszuję panu, panie Murek.
1.0	0.0	0.0	0.0	joy	surprise	Nigdy jeszcze nie widziałam człowieka w takim stanie.
1.0	0.0	0.0	0.0	joy	neutral	Jedno na pierwszym piętrze za sto franków dziennie, drugie na trzecim za dziesięć franków.
1.0	0.0	0.0	0.0	joy	anger	— Od chwili gdy zostałeś panem Egiptu, zbrodniarzami są ci, którzy ośmielają się widywać ciebie i nie zdawać sprawy z tego, o czym raczysz mówić...
1.0	0.0	0.0	0.0	joy	neutral	Sadownik Zajmweł odwiózł do domu zmiętą czerwoną pościel i ostatni wózek zimowych jabłek.
1.0	0.0	0.0	0.0	joy	neutral	Otworzyłem „ Le Figaro ”.
1.0	0.0	0.0	0.0	joy	anticipation	Wyczekawszy jeszcze chwilę, puknął leciuchno w ten sam sposób.
1.0	0.0	0.0	0.0	joy	joy	Dziewczynka też, którą Jan naparł się wziąć od matki, mileńka była, wesoleńka i zawczasu już porządek w chacie robić zaczęła, a i bratowa, choć płocha i w romansach niepowściągniona, dzieci swoje często nawiedzała i jego doglądała, wesołą swoją gadatliwością babską śmiesząc czasem i rozrywając.
1.0	0.0	0.0	0.0	joy	neutral	— pytał karczmarza Zagłoba.
1.0	0.0	0.0	0.0	joy	anger	— Ośle głupi!
1.0	0.0	0.0	0.0	joy	anticipation	— Chciałbym, aby byli przy tym Albert de Morcerf i Raul de Château-Renaud; wiesz pan, że prosiłem ich już na świadków.
1.0	0.0	0.0	0.0	joy	surprise	Gdy Otocki podjechał na Smolną do „ Sygnałów ”, okazało się, że partyjne zebranie jeszcze się nie skończyło.
1.0	0.0	0.0	0.0	joy	anger	— Wykup!
1.0	0.0	0.0	0.0	joy	surprise	Gedymin zwrócił wę nagle ku niemu.
1.0	0.0	0.0	0.0	joy	joy	Młody książę przybywał bardzo wcześnie na miłe wieczory matki, która powtarzała mu ciągle:
1.0	0.0	0.0	0.0	joy	joy	Mimika, gesty, w połączeniu z częstymi zmianami głosu, jakimi Bixiou malował swoje figury, musiały być doskonałe, bo trzej słuchacze wydawali bezwiednie krzyki uznania oraz pomruki radości.
1.0	0.0	0.0	0.0	joy	anger	Nie gadajcie tyle, mówie, za dużo tej gadaniny: dobra kosa dla łąki, dobra bedzie i dla żyta.
1.0	0.0	0.0	0.0	joy	trust	— Zostań pani!... sprawi mi to prawdziwą ulgę pomówić z osobą, obcą jeszcze temu światu kłamstwa i pustoty!
1.0	0.0	0.0	0.0	joy	anger	Ale chyba nie byłbym Rynaldem Montalban, żebym mu tego wszystkiego, mimo jego czarów, drogo nie zapłacił, jak tylko z łoża się zdźwignę.
1.0	0.0	0.0	0.0	joy	trust	Widzisz, że wszystko tak urządziłam, żeby twój portret nie był skończony i żebyś mógł przyjechać do Przytułowa.
1.0	0.0	0.0	0.0	joy	trust	Tak w niej znać było, że ona oddaje mu się z biciem serca, ale zarazem z ufnością, że oddaje mu serce, duszę i całą istotę, całe życie, i to nietylko na dobre, ale na każde chwile życia — i aż do końca życia, że pod tym względem żaden cień nie powstał w umyśle Połanieckiego, a ta pewność uczyniła go w tej chwili lepszym, tkliwszym i wymowniejszym, niż bywał zwykle.
1.0	0.0	0.0	0.0	joy	anger	— Do stu diabłów, są inne środki okazywania miłości, niż Homer.
1.0	0.0	0.0	0.0	joy	surprise	— Oho!
1.0	0.0	0.0	0.0	joy	anticipation	Jednego dnia siostrzenice pani de Montcertin pytały ją, co to jest miłość.
1.0	0.0	0.0	0.0	joy	sadness	Ogólnie wiedziano, że w młodości przeżyła dramat, bo jej narzeczony zginął na froncie w 1920 roku i od tego czasu ani na dzień jeden nie zdjęła po nim żałoby.
1.0	0.0	0.0	0.0	joy	anticipation	Spodziewałam się, że go dostaniemy.
1.0	0.0	0.0	0.0	joy	disgust	Pożyczać u ludzi?
1.0	0.0	0.0	0.0	joy	surprise	— spytał niespodzianie.
1.0	0.0	0.0	0.0	joy	disgust	— Nieruchome spojrzenie Ricarda zbiło go z tropu i dodał zmieszanym tonem: — Mówię, że to pospolity, marny złodziej bez żadnego znaczenia.
1.0	0.0	0.0	0.0	joy	fear	Ale jeżeli mimo wszystko nie zdołam zajść do Niego?
1.0	0.0	0.0	0.0	joy	joy	Szwentas ściskał go i całował.
1.0	0.0	0.0	0.0	joy	anger	— Nie.
1.0	0.0	0.0	0.0	joy	anger	Co znowu?
1.0	0.0	0.0	0.0	joy	fear	— A jeśli pomyłką jest to wszystko?
1.0	0.0	0.0	0.0	joy	anger	— Na to się mu podcina skrzydła!
1.0	0.0	0.0	0.0	joy	anger	Ale nie mogąc się ognać zbereźnikom, które jako te wróble obsiadały sztachety, a śmielsze nawet już pod okna się przebierały, to jeno przygrażał księżym cybuchem a wyklinał.
1.0	0.0	0.0	0.0	joy	anticipation	Niebo, które zatrzymało nas tutaj i zesłało niepogodę umyślnie po to, abyś pan usłyszał historię moich amorów, czegóż znów teraz sobie życzy? ”.
1.0	0.0	0.0	0.0	joy	sadness	— Przychodzi do siebie — powiedziałem — ale bardzo osłabiony.
1.0	0.0	0.0	0.0	joy	joy	Spotkali się oczami.
1.0	0.0	0.0	0.0	joy	joy	Nie przeszkodziło to jednak przyjaciołom utrzymywać dalsze serdeczne stosunki.
1.0	0.0	0.0	0.0	joy	surprise	Ja, znając pułkownika, byłam również pewna, że nie zainteresuje go bliżej ta kwestia.
1.0	0.0	0.0	0.0	joy	joy	— Nawrócony!... nawrócony faraon!...
1.0	0.0	0.0	0.0	joy	fear	Emil czuł, że się dusi.
1.0	0.0	0.0	0.0	joy	surprise	Nie wiedzieć dlaczego, to, co innym wydawało się pochlebne i zaszczytne, ją drażniło i obrażało.
1.0	0.0	0.0	0.0	joy	joy	A jakie z niej porządne i uczciwe dziewczynisko!
1.0	0.0	0.0	0.0	joy	surprise	Z trudem mu go wydarliśmy, a gdy ujrzał go w naszych rękach, był zdumiony.
1.0	0.0	0.0	0.0	joy	sadness	Ona chciałaby pozostać przy swojej mamie, ale jakże to uczynić, jeżeli mama tego nie chce?...
